{
  "$schema": "https://json-schema.org/draft/2020-12/schema",
  "$id": "https://quantstrategylab.github.io/QuantRuntimeSettings/schemas/qsl-m0-research-source-snapshot.v1.schema.json",
  "title": "QSL M0 Research Source Snapshot v1",
  "description": "Closed, read-only transport for QuantAdvisorResearch M0 hypotheses. It carries no strategy, routing, platform, allocation, or execution authority.",
  "type": "object",
  "additionalProperties": false,
  "required": ["schema_version", "source_id", "source_report_digest", "generated_at", "computed_at", "data_status", "hypotheses", "errors"],
  "properties": {
    "schema_version": { "const": "qsl_m0_research_source_snapshot.v1" },
    "source_id": { "type": "string", "pattern": "^[A-Za-z0-9._:/-]{1,128}$" },
    "source_report_digest": { "type": ["string", "null"], "pattern": "^[0-9a-f]{64}$" },
    "generated_at": { "type": ["string", "null"], "format": "date-time", "maxLength": 64 },
    "computed_at": { "type": ["string", "null"], "format": "date-time", "maxLength": 64 },
    "data_status": { "enum": ["ready", "unavailable", "stale"] },
    "hypotheses": {
      "type": "array",
      "maxItems": 500,
      "items": { "$ref": "#/$defs/m0Hypothesis" }
    },
    "errors": {
      "type": "array",
      "maxItems": 20,
      "items": { "type": "string", "pattern": "^[a-z][a-z0-9_.-]{0,63}$" }
    }
  },
  "allOf": [
    {
      "if": { "properties": { "data_status": { "const": "ready" } } },
      "then": {
        "properties": {
          "source_report_digest": { "type": "string", "pattern": "^[0-9a-f]{64}$" },
          "generated_at": { "type": "string", "format": "date-time", "maxLength": 64 },
          "computed_at": { "type": "string", "format": "date-time", "maxLength": 64 },
          "errors": { "maxItems": 0 }
        }
      }
    },
    {
      "if": { "properties": { "data_status": { "const": "unavailable" } } },
      "then": { "properties": { "hypotheses": { "maxItems": 0 } } }
    }
  ],
  "$defs": {
    "m0Hypothesis": {
      "type": "object",
      "additionalProperties": false,
      "required": ["schema_version", "artifact_type", "authority", "no_order", "hypothesis_id", "as_of", "generated_at", "expires_at", "subject", "research_context", "evidence", "provenance", "permitted_next_step"],
      "properties": {
        "schema_version": { "const": "qsl.m0_research_hypothesis.v1" },
        "artifact_type": { "const": "research_hypothesis" },
        "authority": { "const": "research_only" },
        "no_order": { "const": true },
        "hypothesis_id": { "type": "string", "pattern": "^[A-Za-z0-9._:/-]{1,128}$" },
        "as_of": { "type": "string", "format": "date" },
        "generated_at": { "type": "string", "format": "date-time", "maxLength": 64 },
        "expires_at": { "type": "string", "format": "date-time", "maxLength": 64 },
        "subject": {
          "type": "object",
          "additionalProperties": false,
          "required": ["kind", "identifier"],
          "properties": {
            "kind": { "enum": ["asset_idea", "theme_context", "strategy_hypothesis", "risk_context"] },
            "identifier": { "type": "string", "pattern": "^[A-Za-z0-9._:/-]{1,128}$" }
          }
        },
        "research_context": {
          "type": "object",
          "additionalProperties": false,
          "required": ["state", "primary_horizon", "suitable_horizons", "source_confidence", "source_style", "theme_ids"],
          "properties": {
            "state": { "enum": ["candidate", "source_verification_required", "deferred", "context_only"] },
            "primary_horizon": { "enum": ["short", "medium", "long", "not_applicable"] },
            "suitable_horizons": {
              "type": "array",
              "minItems": 1,
              "maxItems": 4,
              "uniqueItems": true,
              "items": { "enum": ["short", "medium", "long", "not_applicable"] }
            },
            "source_confidence": { "enum": ["high", "medium", "low", "mixed", "no_event", "unknown"] },
            "source_style": { "enum": ["event_driven", "long_horizon_growth", "value_quality", "macro_context", "mixed_research"] },
            "theme_ids": {
              "type": "array",
              "maxItems": 24,
              "uniqueItems": true,
              "items": { "type": "string", "pattern": "^[A-Za-z0-9._:/-]{1,128}$" }
            }
          }
        },
        "evidence": {
          "type": "object",
          "additionalProperties": false,
          "required": ["source_entry_digest", "evidence_ref_count", "risk_note_count"],
          "properties": {
            "source_entry_digest": { "type": "string", "pattern": "^[0-9a-f]{64}$" },
            "evidence_ref_count": { "type": "integer", "minimum": 0 },
            "risk_note_count": { "type": "integer", "minimum": 0 }
          }
        },
        "provenance": {
          "type": "object",
          "additionalProperties": false,
          "required": ["source_project", "source_schema_version", "source_contract_version", "source_report_digest", "source_input_digest"],
          "properties": {
            "source_project": { "const": "QuantAdvisorResearch" },
            "source_schema_version": { "type": "string" },
            "source_contract_version": { "type": "string" },
            "source_report_digest": { "type": "string", "pattern": "^[0-9a-f]{64}$" },
            "source_input_digest": {}
          },
          "oneOf": [
            {
              "properties": {
                "source_schema_version": { "const": "5" },
                "source_contract_version": { "const": "model_recommendations.v5" },
                "source_input_digest": { "type": "null" }
              }
            },
            {
              "properties": {
                "source_schema_version": { "const": "6" },
                "source_contract_version": { "const": "model_recommendations.v6" },
                "source_input_digest": { "type": "string", "pattern": "^[0-9a-f]{64}$" }
              }
            }
          ]
        },
        "permitted_next_step": { "const": "research_validation_only" }
      }
    }
  }
}
