{"computed_at":"2026-08-29T07:29:43Z","data_status":"ready","errors":[],"generated_at":"2026-08-29T07:29:43Z","hypotheses":[{"artifact_type":"research_hypothesis","as_of":"2026-06-20","authority":"research_only","evidence":{"evidence_ref_count":3,"risk_note_count":1,"source_entry_digest":"5018b413542d087208c8e82e976da01a9bd105c3607b8d4d398dfd4139ddb9ea"},"expires_at":"2026-09-05T07:29:43Z","generated_at":"2026-08-29T07:29:43Z","hypothesis_id":"m0r-5232ec3d400c8d9a-evt1-5018b413542d0872","no_order":true,"permitted_next_step":"research_validation_only","provenance":{"source_contract_version":"model_recommendations.v5","source_input_digest":null,"source_project":"QuantAdvisorResearch","source_report_digest":"5232ec3d400c8d9a3538d438719f44a76cfafc64d5d7f0acc5a431841bbd261c","source_schema_version":"5"},"research_context":{"primary_horizon":"medium","source_confidence":"medium","source_style":"event_driven","state":"candidate","suitable_horizons":["short","medium"],"theme_ids":[]},"schema_version":"qsl.m0_research_hypothesis.v1","subject":{"identifier":"EVT1","kind":"asset_idea"}}],"schema_version":"qsl_m0_research_source_snapshot.v1","source_id":"quant-advisor-research","source_report_digest":"5232ec3d400c8d9a3538d438719f44a76cfafc64d5d7f0acc5a431841bbd261c"}
